{
  "schemaVersion": "1",
  "kind": "sparse-experiment-workflow-provenance/v1",
  "repository": "ppcdaniel/sarif-regress",
  "workflowPath": ".github/workflows/holdout-validation.yml",
  "workflowRunId": 31638319042,
  "workflowRunAttempt": 1,
  "workflowHeadSha": "4838532f5e808f97bf8804b772d153d294181aee",
  "artifacts": {
    "linux": {
      "name": "sparse-experiment-linux-4838532f5e808f97bf8804b772d153d294181aee",
      "artifactId": 9157879358,
      "archiveSha256": "f3c5ad6a068ad2a3a0c981c1342d54de20a645d376e4be2a7a983a1432b2f939"
    },
    "windows": {
      "name": "sparse-experiment-windows-4838532f5e808f97bf8804b772d153d294181aee",
      "artifactId": 9157886091,
      "archiveSha256": "b95283632cae55c2c69200e0050ba1f01853dbbd88affb505e7dfb3ed9660815"
    }
  },
  "outputs": {
    "sparse-experiment-gate-evidence.json": "269540f7cd7fc9cf4d1e870898e5336461567ae8b76889b013aed990d4bedc8b",
    "sparse-experiment-observations.json": "421a037411c91670961a8ef0ce39c5e3968e4fda8493d1d541396b1d30241e44"
  },
  "repeatedRunByteIdentical": true,
  "linuxWindowsByteIdentical": true
}
